{
  "$schema": "https://crossforge.dev/schemas/gcc-testsuite-baseline.schema.json",
  "schema_version": 1,
  "kind": "gcc-testsuite-baseline",
  "profile": "smoke",
  "plan_sha256": "517de2af8c2d8ce2eee2bd100c3be35db2c97ee5ef3f81558c6ba6fe7a270324",
  "target": "aarch64-unknown-linux-gnu",
  "runtime_tier": "locked-sysroot",
  "unexpected": []
}
