{
  "$schema": "https://crossforge.dev/schemas/gcc-testsuite-baseline.schema.json",
  "schema_version": 1,
  "kind": "gcc-testsuite-baseline",
  "profile": "smoke",
  "plan_sha256": "c6eab2a821dee2f052c4d5523073f2d4f2f5ab6ea6023a3d2302f24d0ba50ebf",
  "target": "x86_64-unknown-linux-gnu",
  "runtime_tier": "host-direct",
  "unexpected": []
}
